ID,original_glossary_extracted,key_phrase,extracted_acronym_1,extracted_acronym_2,definition_or_explanation,source_book
58,"candlestick chart Chart that includes the price range for the day, as well as the opening and closing price. A candlestick bar includes a “body” bounded by the open and close for the period and “shadows” which extend above and below the body to the high and low prices for the period. When the “body” of the candlestick is dark (or red in color charts), the closing price was below the opening. When the body of the candlestick is white (or green in color charts), the closing price was higher than the opening.",candlestick chart,,,"Chart that includes the price range for the day, as well as the opening and closing price. A candlestick bar includes a “body” bounded by the open and close for the period and “shadows” which extend above and below the body to the high and low prices for the period. When the “body” of the candlestick is dark, the closing price was higher than the opening.",Finance - The Options Course - High Profit And Low Stress Trading Methods
59,"cancel (CXL) order An order is used to eliminate a prior order that has not yet been executed. A canceled order must be communicated by a trader to the broker and such an order is not executed or confirmed until the floor broker reports back that the trader is out of the trade. Understand that once an order has been filled, it cannot be canceled, so a CXL order is really only a request to cancel. Therefore, you should not assume an order has been canceled just because you enter a re- quest to do so—wait for the confirmation.",cancel order,,,"An order is used to eliminate a prior order that has not yet been executed. A canceled order must be communicated by a trader to the broker and such an order is not executed or confirmed until the floor broker reports back that the trader is out of the trade. Understand that once an order has been filled, it cannot be canceled, so a CXL order is really only a request to cancel. Therefore, you should not assume an order has been canceled just because you enter a re- quest to do so—wait for the confirmation.",Finance - The Options Course - High Profit And Low Stress Trading Methods
60,capital The amount of money an individual or business has available.,capital,,,The amount of money an individual or business has available.,Finance - The Options Course - High Profit And Low Stress Trading Methods
61,capital gain The profit realized when a capital asset is sold for a higher price than the purchase price.,capital gain,,,The profit realized when a capital asset is sold for a higher price than the purchase price.,Finance - The Options Course - High Profit And Low Stress Trading Methods
62,capitalization Refers to the current value of a corporation's outstanding shares in dollars.,capitalization,,,Refers to the current value of a corporation's outstanding shares in dollars.,Finance - The Options Course - High Profit And Low Stress Trading Methods
63,capital loss The loss incurred when a capital asset is sold for a lower price than the purchase price.,capital loss,,,The loss incurred when a capital asset is sold for a lower price than the purchase price.,Finance - The Options Course - High Profit And Low Stress Trading Methods
64,capped-style option An option with an established profit cap or cap price.,capped style option,,,An option with an established profit cap or cap price.,Finance - The Options Course - High Profit And Low Stress Trading Methods
65,cash account An account in which the customer is required to pay in full for all purchased securities.,cash account,,,An account in which the customer is required to pay in full for all purchased securities.,Finance - The Options Course - High Profit And Low Stress Trading Methods
66,cash dividend A dividend paid in cash to a shareholder out of a corporation's profits.,cash dividend,,,A dividend paid in cash to a shareholder out of a corporation's profits.,Finance - The Options Course - High Profit And Low Stress Trading Methods
67,change The difference between the current price of a security and the price of the previous day.,change,,,The difference between the current price of a security and the price of the previous day.,Finance - The Options Course - High Profit And Low Stress Trading Methods
68,"Chicago Board of Trade (CBOT) Established in 1886, the CBOT is the oldest commodity exchange in the United States and primarily lists grains, Treasury- bonds and notes, metals, and indexes.",Chicago Board of Trade,CBOT,,"Established in 1886, the CBOT is the oldest commodity exchange in the United States and primarily lists grains, Treasury- bonds and notes, metals, and indexes.",Finance - The Options Course - High Profit And Low Stress Trading Methods
69,Chicago Board Options Exchange (CBOE) The largest options exchange in the United States.,Chicago Board Options Exchange,CBOE,,The largest options exchange in the United States.,Finance - The Options Course - High Profit And Low Stress Trading Methods
70,"churning When a registered representative performs excessive trading in a cus- tomer's account to increase commissions. This is deemed illegal by the SEC and exchange rules, since the registered representative is not seeking improved re- turns and does not have the customer's interests in mind.",churning,,,"When a registered representative performs excessive trading in a cus- tomer's account to increase commissions. This is deemed illegal by the SEC and exchange rules, since the registered representative is not seeking improved re- turns and does not have the customer's interests in mind.",Finance - The Options Course - High Profit And Low Stress Trading Methods
71,"class of options Option contracts of the same type (call or put), style, and un- derlying security.",class of options,,,"Option contracts of the same type, style, and un- derlying security.",Finance - The Options Course - High Profit And Low Stress Trading Methods
72,clearinghouse An institution established separately from the exchanges to en- sure timely payment and delivery of securities.,clearinghouse,,,An institution established separately from the exchanges to en- sure timely payment and delivery of securities.,Finance - The Options Course - High Profit And Low Stress Trading Methods
73,close The price of the last transaction for a particular security each day.,close,,,The price of the last transaction for a particular security each day.,Finance - The Options Course - High Profit And Low Stress Trading Methods
74,closing purchase A transaction to eliminate a short position.,closing purchase,,,A transaction to eliminate a short position.,Finance - The Options Course - High Profit And Low Stress Trading Methods
75,closing range The high and low prices recorded during the period designated as the official close.,closing range,,,The high and low prices recorded during the period designated as the official close.,Finance - The Options Course - High Profit And Low Stress Trading Methods
76,closing sale A transaction to eliminate a long position.,closing sale,,,A transaction to eliminate a long position.,Finance - The Options Course - High Profit And Low Stress Trading Methods
77,commission A service charge assessed by a broker and his/her investment com- pany in return for arranging the purchase or sale of a security.,commission,,,A service charge assessed by a broker and his/her investment com- pany in return for arranging the purchase or sale of a security.,Finance - The Options Course - High Profit And Low Stress Trading Methods
78,"commodity Any bulk good traded on an exchange (for example, metals, grains, and meats).",commodity,,,Any bulk good traded on an exchange.,Finance - The Options Course - High Profit And Low Stress Trading Methods
79,Commodity Futures Trading Commission (CFTC) A commission created by the Commodity Futures Trading Commission Act of 1974 to ensure the open and effi- cient operation of the futures markets.,Commodity Futures Trading Commission,CFTC,,A commission created by the Commodity Futures Trading Commission Act of 1974 to ensure the open and effi- cient operation of the futures markets.,Finance - The Options Course - High Profit And Low Stress Trading Methods
80,"condor The sale or purchase of two options with consecutive exercise prices, to- gether with the sale or purchase of one option with an immediately lower exercise price and one option with an immediately higher exercise price.",condor,,,"The sale or purchase of two options with consecutive exercise prices, to- gether with the sale or purchase of one option with an immediately lower exercise price and one option with an immediately higher exercise price.",Finance - The Options Course - High Profit And Low Stress Trading Methods
81,"consolidation pattern A resting period where the price action is in equilibrium. Typically, price action narrows and the volume drops off while investors and traders attempt to get a better sense of the next move, up or down. Visually, a con- solidating market may resemble a triangle or a rectangle.",consolidation pattern,,,"A resting period where the price action is in equilibrium. Typically, price action narrows and the volume drops off while investors and traders attempt to get a better sense of the next move, up or down. Visually, a con- solidating market may resemble a triangle or a rectangle.",Finance - The Options Course - High Profit And Low Stress Trading Methods
82,consumer price index (CPI) A measure of price changes in consumer goods and services. This index is used to identify periods of economic inflation or deflation.,consumer price index,CPI,,A measure of price changes in consumer goods and services. This index is used to identify periods of economic inflation or deflation.,Finance - The Options Course - High Profit And Low Stress Trading Methods
83,"contract A unit of trading for a financial or commodity future, or option.",contract,,,"A unit of trading for a financial or commodity future, or option.",Finance - The Options Course - High Profit And Low Stress Trading Methods
84,contrarian approach Trading against the majority view of the marketplace.,contrarian approach,,,Trading against the majority view of the marketplace.,Finance - The Options Course - High Profit And Low Stress Trading Methods
85,correction A sudden decline in the price of a security or securities after a period of market strength.,correction,,,A sudden decline in the price of a security or securities after a period of market strength.,Finance - The Options Course - High Profit And Low Stress Trading Methods
86,covered call A short call option position against a long position in an underlying stock or future.,covered call,,,A short call option position against a long position in an underlying stock or future.,Finance - The Options Course - High Profit And Low Stress Trading Methods
87,covered put A short put option position against a short position in an underlying stock or future.,covered put,,,A short put option position against a short position in an underlying stock or future.,Finance - The Options Course - High Profit And Low Stress Trading Methods
88,cover the short To buy shares of stock to replenish those borrowed from your brokerage to place a short sale.,cover the short,,,To buy shares of stock to replenish those borrowed from your brokerage to place a short sale.,Finance - The Options Course - High Profit And Low Stress Trading Methods
89,"credit spread The difference in value between two options, where the value of the short position exceeds the value of the long position.",credit spread,,,"The difference in value between two options, where the value of the short position exceeds the value of the long position.",Finance - The Options Course - High Profit And Low Stress Trading Methods
90,cross rate The current exchange rate between differing currencies.,cross rate,,,The current exchange rate between differing currencies.,Finance - The Options Course - High Profit And Low Stress Trading Methods
91,"cycle The tendency for price action to repeat uptrends and downtrends in a relatively predictable fashion over a prescribed period of time. Price cycles are measured low to low, high to high, or low to high. Various types of measure- ments are possible.",cycle,,,"The tendency for price action to repeat uptrends and downtrends in a relatively predictable fashion over a prescribed period of time. Price cycles are measured low to low, high to high, or low to high. Various types of measure- ments are possible.",Finance - The Options Course - High Profit And Low Stress Trading Methods
92,daily range The difference between the high and low price of a security in one trading day.,daily range,,,The difference between the high and low price of a security in one trading day.,Finance - The Options Course - High Profit And Low Stress Trading Methods
93,day order An order to buy or sell a security that expires if not filled by the end of the day.,day order,,,An order to buy or sell a security that expires if not filled by the end of the day.,Finance - The Options Course - High Profit And Low Stress Trading Methods
94,day trade The purchase and sale of a position in the same day.,day trade,,,The purchase and sale of a position in the same day.,Finance - The Options Course - High Profit And Low Stress Trading Methods
95,day trading An approach to trading in which the same position is entered and exited within one day.,day trading,,,An approach to trading in which the same position is entered and exited within one day.,Finance - The Options Course - High Profit And Low Stress Trading Methods
96,"debit spread The difference in value between two options, where the value of the long position exceeds the value of the short position.",debit spread,,,"The difference in value between two options, where the value of the long position exceeds the value of the short position.",Finance - The Options Course - High Profit And Low Stress Trading Methods
97,deep in-the-money A deep in-the-money call option has a strike price well below the current price of the underlying instrument. A deep in-the-money put option,deep in the money,,,A deep in-the-money call option has a strike price well below the current price of the underlying instrument. A deep in-the-money put option,Finance - The Options Course - High Profit And Low Stress Trading Methods
99,delayed-time quotes Quotes from a data service provider that are delayed up to 20 minutes from real-time quotes.,delayed time quotes,,,Quotes from a data service provider that are delayed up to 20 minutes from real-time quotes.,Finance - The Options Course - High Profit And Low Stress Trading Methods
100,delta The amount by which the price (premium) of an option changes for every dollar move in the underlying instrument.,delta,,,The amount by which the price of an option changes for every dollar move in the underlying instrument.,Finance - The Options Course - High Profit And Low Stress Trading Methods
101,delta-hedged An options strategy protecting an option against price changes in the option's underlying instrument by balancing the overall position delta to zero.,delta hedged,,,An options strategy protecting an option against price changes in the option's underlying instrument by balancing the overall position delta to zero.,Finance - The Options Course - High Profit And Low Stress Trading Methods
102,delta neutral A position arranged by selecting a calculated ratio of short and long positions that balance out to an overall position delta of zero.,delta neutral,,,A position arranged by selecting a calculated ratio of short and long positions that balance out to an overall position delta of zero.,Finance - The Options Course - High Profit And Low Stress Trading Methods
103,delta position A measure of option or underlying securities delta.,delta position,,,A measure of option or underlying securities delta.,Finance - The Options Course - High Profit And Low Stress Trading Methods
104,derivative Financial instruments based on the market value of an underlying asset.,derivative,,,Financial instruments based on the market value of an underlying asset.,Finance - The Options Course - High Profit And Low Stress Trading Methods
105,"descending triangle A sideways price pattern with two converging trend lines; the top trend line is declining (resistance), while the bottom trend line is relatively flat (support). This is generally considered a bearish formation, since most of the time it will break out to the downside.",descending triangle,,,"A sideways price pattern with two converging trend lines; the top trend line is declining. This is generally considered a bearish formation, since most of the time it will break out to the downside.",Finance - The Options Course - High Profit And Low Stress Trading Methods
106,"discount brokers Brokerage firms that offer lower commission rates than full-service brokers, but do not offer services such as advice, research, and portfolio planning.",discount brokers,,,"Brokerage firms that offer lower commission rates than full-service brokers, but do not offer services such as advice, research, and portfolio planning.",Finance - The Options Course - High Profit And Low Stress Trading Methods
107,divergence When two or more averages or indexes fail to show confirming trends.,divergence,,,When two or more averages or indexes fail to show confirming trends.,Finance - The Options Course - High Profit And Low Stress Trading Methods
108,dividend A sum of money paid out to a shareholder from the stock's profits.,dividend,,,A sum of money paid out to a shareholder from the stock's profits.,Finance - The Options Course - High Profit And Low Stress Trading Methods
109,"Dow Jones Industrial Average (DJIA) Used as an overall indicator of market performance, this average is composed of 30 blue-chip stocks that are traded daily on the New York Stock Exchange.",Dow Jones Industrial Average,DJIA,,"Used as an overall indicator of market performance, this average is composed of 30 blue-chip stocks that are traded daily on the New York Stock Exchange.",Finance - The Options Course - High Profit And Low Stress Trading Methods
110,downside The potential for prices to decrease.,downside,,,The potential for prices to decrease.,Finance - The Options Course - High Profit And Low Stress Trading Methods
111,downside breakeven The lower price at which a trade breaks even.,downside breakeven,,,The lower price at which a trade breaks even.,Finance - The Options Course - High Profit And Low Stress Trading Methods
112,downside risk The potential risk one takes if prices decrease in directional trading.,downside risk,,,The potential risk one takes if prices decrease in directional trading.,Finance - The Options Course - High Profit And Low Stress Trading Methods
113,each way The commission made by a broker for the purchase and sale sides of a trade.,each way,,,The commission made by a broker for the purchase and sale sides of a trade.,Finance - The Options Course - High Profit And Low Stress Trading Methods
114,earnings The net profit for a company after all expenses are deducted.,earnings,,,The net profit for a company after all expenses are deducted.,Finance - The Options Course - High Profit And Low Stress Trading Methods
115,earnings per share (EPS) The net profit for a company allocated on an individ- ual share of stock basis.,earnings per share,EPS,,The net profit for a company allocated on an individ- ual share of stock basis.,Finance - The Options Course - High Profit And Low Stress Trading Methods
116,"Elliott wave theory A technical tool based on R. N. Elliott's work in the 1930s. Elliott believed the charted price activity of a market is the graphical representa- tion of mass psychology. In other words, the Elliott wave theory organizes the",Elliott wave theory,,,"A technical tool based on R. N. Elliott's work in the 1930s. Elliott believed the charted price activity of a market is the graphical representa- tion of mass psychology. In other words, the Elliott wave theory organizes the",Finance - The Options Course - High Profit And Low Stress Trading Methods
117,"seemingly random flow of market price action into identifiable, predictable pat- terns based on the natural progression of crowd psychology. Elliott wave theory is based on the premise that markets will move in ratios and patterns that reflect human nature. The classic Elliott wave pattern consists of two different types of waves. The first consists of a five-wave sequence called an impulse wave and the second is a three-wave sequence called a corrective wave. Usually, but not al- ways, the market will move in a corrective wave after a five-wave move in the other direction.","seemingly random flow of market price action into identifiable, predictable pat  terns based on the natural progression of crowd psychology.",,,"Elliott wave theory is based on the premise that markets will move in ratios and patterns that reflect human nature. The classic Elliott wave pattern consists of two different types of waves. The first consists of a five-wave sequence called an impulse wave and the second is a three-wave sequence called a corrective wave. Usually, but not al- ways, the market will move in a corrective wave after a five-wave move in the other direction.",Finance - The Options Course - High Profit And Low Stress Trading Methods
118,end of day The close of the trading day when market prices settle.,end of day,,,The close of the trading day when market prices settle.,Finance - The Options Course - High Profit And Low Stress Trading Methods
119,EPS Rank An Investor's Business Daily list of companies ranked from 0 to 100 by the strength of each company's earnings per share.,EPS Rank An Investor's Business,,,Daily list of companies ranked from 0 to 100 by the strength of each company's earnings per share.,Finance - The Options Course - High Profit And Low Stress Trading Methods
120,equilibrium A price level in a sideways market equidistant from the resistance and support levels.,equilibrium,,,A price level in a sideways market equidistant from the resistance and support levels.,Finance - The Options Course - High Profit And Low Stress Trading Methods
121,"Eurodollars Dollars deposited in foreign banks, with the futures contract reflect- ing the rates offered between U.S. banks and foreign banks.",Eurodollars,,,"Dollars deposited in foreign banks, with the futures contract reflect- ing the rates offered between U.S. banks and foreign banks.",Finance - The Options Course - High Profit And Low Stress Trading Methods
122,European-style option An option contract that can be exercised only on the ex- piration date.,European style option,,,An option contract that can be exercised only on the ex- piration date.,Finance - The Options Course - High Profit And Low Stress Trading Methods
123,"exchange The location where an asset, option, future, stock, or derivative is bought and sold.",exchange,,,"The location where an asset, option, future, stock, or derivative is bought and sold.",Finance - The Options Course - High Profit And Low Stress Trading Methods
124,exchange rate The price at which one country's currency can be converted into another country's currency.,exchange rate,,,The price at which one country's currency can be converted into another country's currency.,Finance - The Options Course - High Profit And Low Stress Trading Methods
125,exercise The process of implementing an option's right to buy or sell the under- lying security.,exercise,,,The process of implementing an option's right to buy or sell the under- lying security.,Finance - The Options Course - High Profit And Low Stress Trading Methods
126,exercise price A price at which the stock or commodity underlying a call or put option can be purchased (call) or sold (put) over the specified period. (Same as strike price.),exercise price,,,A price at which the stock or commodity underlying a call or put option can be purchased,Finance - The Options Course - High Profit And Low Stress Trading Methods
127,expiration The date and time after which an option may no longer be exercised.,expiration,,,The date and time after which an option may no longer be exercised.,Finance - The Options Course - High Profit And Low Stress Trading Methods
128,expiration date The last day on which an option may be exercised.,expiration date,,,The last day on which an option may be exercised.,Finance - The Options Course - High Profit And Low Stress Trading Methods
129,explosive Refers to an opportunity that can yield large profits with usually a lim- ited risk in a short amount of time.,explosive,,,Refers to an opportunity that can yield large profits with usually a lim- ited risk in a short amount of time.,Finance - The Options Course - High Profit And Low Stress Trading Methods
130,extrinsic value The price of an option less its intrinsic value. An out-of-the- money option's worth consists of nothing but extrinsic or time value. (Same as time value.),extrinsic value,,,The price of an option less its intrinsic value. An out-of-the- money option's worth consists of nothing but extrinsic or time value.,Finance - The Options Course - High Profit And Low Stress Trading Methods
131,fade Refers to selling a rising price or buying a falling price.,fade,,,Refers to selling a rising price or buying a falling price.,Finance - The Options Course - High Profit And Low Stress Trading Methods
