ID,original_glossary_extracted,key_phrase,extracted_acronym_1,extracted_acronym_2,definition_or_explanation,source_book
0,ABC wave Elliott wave terminology for a three-wave countertrend price move- ment. Wave A is the first price wave against the trend of the market. Wave B is a corrective wave to Wave A. Wave C is the final price move to complete the coun- tertrend price action.,ABC wave,,,Elliott wave terminology for a three-wave countertrend price move- ment. Wave A is the first price wave against the trend of the market. Wave B is a corrective wave to Wave A. Wave C is the final price move to complete the coun- tertrend price action.,Finance - The Options Course - High Profit And Low Stress Trading Methods
1,adjustment The process of buying or selling instruments to bring a position delta back to zero and increase profits.,adjustment,,,The process of buying or selling instruments to bring a position delta back to zero and increase profits.,Finance - The Options Course - High Profit And Low Stress Trading Methods
2,All Ordinaries Index The major index of Australian stocks. This index repre- sents 280 of the most active listed companies or the majority of the equity  capitalization (excluding foreign companies) listed on the Australian Stock Ex- change (ASX).,All Ordinaries Index,,,The major index of Australian stocks. This index repre- sents 280 of the most active listed companies or the majority of the equity  capitalization.,Finance - The Options Course - High Profit And Low Stress Trading Methods
3,"American Stock Exchange (AMEX) A private, not-for-profit corporation, located in New York City, that handles approximately one-fifth of all securities trades within the United States.",American Stock Exchange,AMEX,,"A private, not-for-profit corporation, located in New York City, that handles approximately one-fifth of all securities trades within the United States.",Finance - The Options Course - High Profit And Low Stress Trading Methods
4,American-style option An option contract that can be exercised at any time be- tween the date of purchase and the expiration date. Most exchange-traded options are American-style.,American style option,,,An option contract that can be exercised at any time be- tween the date of purchase and the expiration date. Most exchange-traded options are American-style.,Finance - The Options Course - High Profit And Low Stress Trading Methods
5,amortization The paying off of debt in regular installments over a period of time.,amortization,,,The paying off of debt in regular installments over a period of time.,Finance - The Options Course - High Profit And Low Stress Trading Methods
6,analyst Employee of a brokerage or fund management house who studies com- panies and makes buy and sell recommendations on their stocks. Most specialize in a specific industry.,analyst,,,Employee of a brokerage or fund management house who studies com- panies and makes buy and sell recommendations on their stocks. Most specialize in a specific industry.,Finance - The Options Course - High Profit And Low Stress Trading Methods
7,annual earnings change (percent) The historical earnings change between the most recently reported fiscal year earnings and the preceding year earnings.,annual earnings change,,,The historical earnings change between the most recently reported fiscal year earnings and the preceding year earnings.,Finance - The Options Course - High Profit And Low Stress Trading Methods
8,annual net profit margin (percent) The percentage that the company earned from gross sales for the most recently reported fiscal year.,annual net profit margin,,,The percentage that the company earned from gross sales for the most recently reported fiscal year.,Finance - The Options Course - High Profit And Low Stress Trading Methods
9,"annual percentage rate (APR) The cost of credit that the consumer pays, ex- pressed as a simple annual percentage.",annual percentage rate,APR,,"The cost of credit that the consumer pays, ex- pressed as a simple annual percentage.",Finance - The Options Course - High Profit And Low Stress Trading Methods
10,annual rate of return The simple rate of return earned by an investor for each year.,annual rate of return,,,The simple rate of return earned by an investor for each year.,Finance - The Options Course - High Profit And Low Stress Trading Methods
11,"annual report A report issued by a company to its shareholders at the end of the fiscal year, containing a description of the firm's operations and financial statements.",annual report,,,"A report issued by a company to its shareholders at the end of the fiscal year, containing a description of the firm's operations and financial statements.",Finance - The Options Course - High Profit And Low Stress Trading Methods
12,"annuity A series of constant payments at uniform time intervals (for example, periodic interest payments on a bond).",annuity,,,A series of constant payments at uniform time intervals.,Finance - The Options Course - High Profit And Low Stress Trading Methods
13,appreciation The increase in value of an asset.,appreciation,,,The increase in value of an asset.,Finance - The Options Course - High Profit And Low Stress Trading Methods
14,"arbitrage The simultaneous purchase and sale of identical financial instruments or commodity futures in order to make a profit, where the selling price is higher than the buying price.",arbitrage,,,"The simultaneous purchase and sale of identical financial instruments or commodity futures in order to make a profit, where the selling price is higher than the buying price.",Finance - The Options Course - High Profit And Low Stress Trading Methods
15,arbitrageur An individual or company who takes advantage of momentary dis- parities in prices between markets to lock in profits because the selling price is higher than the buying price.,arbitrageur,,,An individual or company who takes advantage of momentary dis- parities in prices between markets to lock in profits because the selling price is higher than the buying price.,Finance - The Options Course - High Profit And Low Stress Trading Methods
16,"ascending triangle A sideways price pattern with two converging trend lines; the top trend line is relatively flat (resistance), while the bottom trend line (sup- port) is rising. This is generally considered a bullish formation, since most of the time it will break out to the upside.",ascending triangle,,,"A sideways price pattern with two converging trend lines; the top trend line is relatively flat is rising. This is generally considered a bullish formation, since most of the time it will break out to the upside.",Finance - The Options Course - High Profit And Low Stress Trading Methods
17,"ask The lowest price of a specific market that market makers, floor brokers, or specialists are willing to sell at.",ask,,,"The lowest price of a specific market that market makers, floor brokers, or specialists are willing to sell at.",Finance - The Options Course - High Profit And Low Stress Trading Methods
18,"assignment When the short option position is notified of the long position's in- tent to exercise. The long position exercises and the short position is assigned. The long position has the right to exercise; if the trader chooses to exercise, the short position must oblige.",assignment,,,"When the short option position is notified of the long position's in- tent to exercise. The long position exercises and the short position is assigned. The long position has the right to exercise; if the trader chooses to exercise, the short position must oblige.",Finance - The Options Course - High Profit And Low Stress Trading Methods
19,at-the-money (ATM) When the strike price of an option is the same as the cur- rent price of the underlying instrument.,at the money,ATM,,When the strike price of an option is the same as the cur- rent price of the underlying instrument.,Finance - The Options Course - High Profit And Low Stress Trading Methods
20,at-the-opening order An order that specifies execution at the opening of the market or else it is canceled.,at the opening order,,,An order that specifies execution at the opening of the market or else it is canceled.,Finance - The Options Course - High Profit And Low Stress Trading Methods
21,"auction market A market in which buyers enter competitive bids and sellers en- ter competitive offers simultaneously. Most stock and bond markets, including those on the NYSE, function this way.",auction market,,,"A market in which buyers enter competitive bids and sellers en- ter competitive offers simultaneously. Most stock and bond markets, including those on the NYSE, function this way.",Finance - The Options Course - High Profit And Low Stress Trading Methods
22,automatic exercise The automatic exercise of an in-the-money option at expira- tion by the clearing firm.,automatic exercise,,,The automatic exercise of an in-the-money option at expira- tion by the clearing firm.,Finance - The Options Course - High Profit And Low Stress Trading Methods
23,"Average Directional Index (ADX) Developed by Welles Wilder, the ADX indi- cates the degree in which a security is trending. It is a normalized index that uses the components of the Directional Movement Indicator (DMI). It is typically calcu- lated for a 14-period time frame and does not usually move into extreme ranges. The ADX indicates a trending market when the indicator is rising and a nontrend- ing market when the indicator is falling. Standard use of the ADX includes the fol- lowing: an ADX line rising above 20, signals a trending market, while an ADX line falling below 40, signals the start of a nontrending environment.",Average Directional Index.,ADX,,"It is typically calcu- lated for a 14-period time frame and does not usually move into extreme ranges. The ADX indicates a trending market when the indicator is rising and a nontrend- ing market when the indicator is falling. Standard use of the ADX includes the fol- lowing: an ADX line rising above 20, signals a trending market, while an ADX line falling below 40, signals the start of a nontrending environment.",Finance - The Options Course - High Profit And Low Stress Trading Methods
24,back months The futures or options on futures months being traded that are fur- thest from expiration.,back months,,,The futures or options on futures months being traded that are fur- thest from expiration.,Finance - The Options Course - High Profit And Low Stress Trading Methods
25,backspread A spread in which more options are purchased than sold and where all options have the same underlying asset and expiration date. Backspreads are usually delta neutral.,backspread,,,A spread in which more options are purchased than sold and where all options have the same underlying asset and expiration date. Backspreads are usually delta neutral.,Finance - The Options Course - High Profit And Low Stress Trading Methods
26,back-testing The testing of a strategy based on historical data to see if the re- sults are consistent.,back testing,,,The testing of a strategy based on historical data to see if the re- sults are consistent.,Finance - The Options Course - High Profit And Low Stress Trading Methods
27,"balance sheet A financial statement providing an instant picture of a firm's or in- dividual's financial position; lists assets, liabilities, and net worth.",balance sheet,,,"A financial statement providing an instant picture of a firm's or in- dividual's financial position; lists assets, liabilities, and net worth.",Finance - The Options Course - High Profit And Low Stress Trading Methods
28,"bar chart A chart composed of a vertical bar in the center that shows the price range for the period, as well as a horizontal hash mark that identifies the opening price. By reviewing the chart alone, a trader can determine the high and low trades for the time period designated on the chart.",bar chart,,,"A chart composed of a vertical bar in the center that shows the price range for the period, as well as a horizontal hash mark that identifies the opening price. By reviewing the chart alone, a trader can determine the high and low trades for the time period designated on the chart.",Finance - The Options Course - High Profit And Low Stress Trading Methods
29,bear An investor who believes that a security or the market is falling or is ex- pected to fall.,bear,,,An investor who believes that a security or the market is falling or is ex- pected to fall.,Finance - The Options Course - High Profit And Low Stress Trading Methods
30,bear call spread A strategy in which a trader sells a lower strike call and buys a higher strike call to create a trade with limited profit and limited risk. A fall in the price of the underlying asset increases the value of the spread. Net credit transac- tion; maximum loss = difference between the strike prices less net credit; maxi- mum gain = net credit.,bear call spread,,,A strategy in which a trader sells a lower strike call and buys a higher strike call to create a trade with limited profit and limited risk. A fall in the price of the underlying asset increases the value of the spread. Net credit transac- tion; maximum loss = difference between the strike prices less net credit; maxi- mum gain = net credit.,Finance - The Options Course - High Profit And Low Stress Trading Methods
31,"bear market A declining stock market over a prolonged period of time, usually caused by a weak economy and subsequent decreased corporate profits.",bear market,,,"A declining stock market over a prolonged period of time, usually caused by a weak economy and subsequent decreased corporate profits.",Finance - The Options Course - High Profit And Low Stress Trading Methods
32,bear put spread A strategy in which a trader sells a lower strike put and buys a higher strike put to create a trade with limited profit and limited risk. A fall in the price of the underlying asset increases the value of the spread. Net debit transac- tion; maximum gain = difference between strike prices less the net debit; maxi- mum loss = net debit.,bear put spread,,,A strategy in which a trader sells a lower strike put and buys a higher strike put to create a trade with limited profit and limited risk. A fall in the price of the underlying asset increases the value of the spread. Net debit transac- tion; maximum gain = difference between strike prices less the net debit; maxi- mum loss = net debit.,Finance - The Options Course - High Profit And Low Stress Trading Methods
33,"bid The highest price at which a floor broker, trader, or dealer is willing to buy a security or commodity for a specified time.",bid,,,"The highest price at which a floor broker, trader, or dealer is willing to buy a security or commodity for a specified time.",Finance - The Options Course - High Profit And Low Stress Trading Methods
34,bid and asked The bid (the highest price a buyer is prepared to pay for a trading asset) and the asked (the lowest price acceptable to a prospective seller of the same security) together comprise a quotation or quote.,bid and asked,,,The bid together comprise a quotation or quote.,Finance - The Options Course - High Profit And Low Stress Trading Methods
35,bid-asked spread The difference between bid and asked prices.,bid asked spread,,,The difference between bid and asked prices.,Finance - The Options Course - High Profit And Low Stress Trading Methods
36,bid up When demand for an asset drives up the price paid by buyers.,bid up,,,When demand for an asset drives up the price paid by buyers.,Finance - The Options Course - High Profit And Low Stress Trading Methods
37,"block trade A trade so large (for example, 5,000 shares of stock or $200,000 worth of bonds) that the normal auction market cannot absorb it in a reasonable time at a reasonable price.",block trade,,,A trade so large that the normal auction market cannot absorb it in a reasonable time at a reasonable price.,Finance - The Options Course - High Profit And Low Stress Trading Methods
38,blow-off top A steep and rapid increase in price followed by a steep and rapid drop in price. This indicator is often used in technical analysis.,blow off top,,,A steep and rapid increase in price followed by a steep and rapid drop in price. This indicator is often used in technical analysis.,Finance - The Options Course - High Profit And Low Stress Trading Methods
39,"blue-chip stock A stock with solid value, good security, and a record of dividend payments or other desirable investment characteristics with the best market capi- talization in the marketplace. Many times these stocks have a record of consistent dividend payments, receive extensive media coverage, and offer a host of other beneficial investment attributes. This term is derived from poker, where blue chips hold the most value. On the downside, blue-chip stocks tend to be quite expensive and often have little room for growth.",blue chip stock,,,"A stock with solid value, good security, and a record of dividend payments or other desirable investment characteristics with the best market capi- talization in the marketplace. Many times these stocks have a record of consistent dividend payments, receive extensive media coverage, and offer a host of other beneficial investment attributes. This term is derived from poker, where blue chips hold the most value. On the downside, blue-chip stocks tend to be quite expensive and often have little room for growth.",Finance - The Options Course - High Profit And Low Stress Trading Methods
40,board lot The smallest quantity of shares traded on an exchange at standard commission rates.,board lot,,,The smallest quantity of shares traded on an exchange at standard commission rates.,Finance - The Options Course - High Profit And Low Stress Trading Methods
41,"Bollinger bands Specific types of envelopes that use expanding and contract- ing values employed as a lagging indicator. This is accomplished by setting the envelope lines above and below the moving average equal to a value that varies with price. Commonly used settings for Bollinger bands include the 20-period ex- ponential moving average, plus or minus two standard deviations, to create the envelope channels.",Bollinger bands,,,"Specific types of envelopes that use expanding and contract- ing values employed as a lagging indicator. This is accomplished by setting the envelope lines above and below the moving average equal to a value that varies with price. Commonly used settings for Bollinger bands include the 20-period ex- ponential moving average, plus or minus two standard deviations, to create the envelope channels.",Finance - The Options Course - High Profit And Low Stress Trading Methods
42,"bond Financial instruments representing debt obligations issued by the govern- ment or corporations traded in the futures market. A bond promises to pay its holders periodic interest at a fixed rate (the coupon), and to repay the principal of the loan at maturity. Bonds are issued with a par or face value of $1,000 and are traded based on their interest rates—if the bond pays more interest than available elsewhere, its worth increases.",bond,,,"Financial instruments representing debt obligations issued by the govern- ment or corporations traded in the futures market. A bond promises to pay its holders periodic interest at a fixed rate, and to repay the principal of the loan at maturity. Bonds are issued with a par or face value of $1,000 and are traded based on their interest rates—if the bond pays more interest than available elsewhere, its worth increases.",Finance - The Options Course - High Profit And Low Stress Trading Methods
43,break out A rise in the price of an underlying instrument above its resistance level or a drop below the support level.,break out,,,A rise in the price of an underlying instrument above its resistance level or a drop below the support level.,Finance - The Options Course - High Profit And Low Stress Trading Methods
44,"broad-based index An index designed to reflect the movement of the market as a whole (for example, the S&P 100, the S&P 500, and the Amex Major Market Index).",broad based index,,,An index designed to reflect the movement of the market as a whole.,Finance - The Options Course - High Profit And Low Stress Trading Methods
45,broker An individual or firm that charges a commission for executing buy and sell orders.,broker,,,An individual or firm that charges a commission for executing buy and sell orders.,Finance - The Options Course - High Profit And Low Stress Trading Methods
46,bull An investor who believes that a market is rising or is expected to rise.,bull,,,An investor who believes that a market is rising or is expected to rise.,Finance - The Options Course - High Profit And Low Stress Trading Methods
47,bull call spread A strategy in which a trader buys a lower strike call and sells a higher strike call to create a trade with limited profit and limited risk. A rise in the price of the underlying asset increases the value of the spread. Net debit transac- tion; maximum loss = net debit; maximum gain = difference between strike prices less the net debit.,bull call spread,,,A strategy in which a trader buys a lower strike call and sells a higher strike call to create a trade with limited profit and limited risk. A rise in the price of the underlying asset increases the value of the spread. Net debit transac- tion; maximum loss = net debit; maximum gain = difference between strike prices less the net debit.,Finance - The Options Course - High Profit And Low Stress Trading Methods
48,"bull market A rising stock market over a prolonged period of time, usually caused by a strong economy and subsequent increased corporate profits.",bull market,,,"A rising stock market over a prolonged period of time, usually caused by a strong economy and subsequent increased corporate profits.",Finance - The Options Course - High Profit And Low Stress Trading Methods
49,bull put spread A strategy in which a trader sells a higher strike put and buys a lower strike put to create a trade with limited profit and limited risk. A rise in the price of the underlying asset increases the value of the spread. Net credit transac- tion; maximum loss = difference between strike prices less net credit; maximum gain = net credit.,bull put spread,,,A strategy in which a trader sells a higher strike put and buys a lower strike put to create a trade with limited profit and limited risk. A rise in the price of the underlying asset increases the value of the spread. Net credit transac- tion; maximum loss = difference between strike prices less net credit; maximum gain = net credit.,Finance - The Options Course - High Profit And Low Stress Trading Methods
50,"butterfly spread The sale (or purchase) of two identical options, together with the purchase (or sale) of one option with an immediately higher strike, and one option with an immediately lower strike. All options must be the same type, have the same underlying asset, and have the same expiration date.",butterfly spread,,,"The sale of one option with an immediately higher strike, and one option with an immediately lower strike. All options must be the same type, have the same underlying asset, and have the same expiration date.",Finance - The Options Course - High Profit And Low Stress Trading Methods
51,buy on close To buy at the end of a trading session at a price within the closing range.,buy on close,,,To buy at the end of a trading session at a price within the closing range.,Finance - The Options Course - High Profit And Low Stress Trading Methods
52,buy on opening To buy at the beginning of a trading session at a price within the opening range.,buy on opening,,,To buy at the beginning of a trading session at a price within the opening range.,Finance - The Options Course - High Profit And Low Stress Trading Methods
53,"buy stop order An order to purchase a security entered at a price above the cur- rent offering price, triggered when the market hits a specified price.",buy stop order,,,"An order to purchase a security entered at a price above the cur- rent offering price, triggered when the market hits a specified price.",Finance - The Options Course - High Profit And Low Stress Trading Methods
54,CAC 40 Index A broad-based index of 40 common stocks on the Paris Bourse.,CAC 40 Index,,,A broad-based index of 40 common stocks on the Paris Bourse.,Finance - The Options Course - High Profit And Low Stress Trading Methods
55,calendar spread A spread consisting of one long option with a far off expiration month and one short option with 30 to 45 days until expiration. Both options must be the same type and have the same exercise price.,calendar spread,,,A spread consisting of one long option with a far off expiration month and one short option with 30 to 45 days until expiration. Both options must be the same type and have the same exercise price.,Finance - The Options Course - High Profit And Low Stress Trading Methods
56,"call option An option contract which gives the holder the right, but not the oblig- ation, to buy a specified amount of an underlying security at a specified price within a specified time in exchange for paying a premium.",call option,,,"An option contract which gives the holder the right, but not the oblig- ation, to buy a specified amount of an underlying security at a specified price within a specified time in exchange for paying a premium.",Finance - The Options Course - High Profit And Low Stress Trading Methods
57,call premium The amount a call option costs.,call premium,,,The amount a call option costs.,Finance - The Options Course - High Profit And Low Stress Trading Methods
