ID,original_glossary_extracted,key_phrase,extracted_acronym_1,extracted_acronym_2,definition_or_explanation,source_book
132,"failed rally The inability of a market to sustain an upward move, often associ- ated with a pattern that does not resolve itself in an expected upward direction. The most typical evidence of a failed rally is diminishing volume.",failed rally,,,"The inability of a market to sustain an upward move, often associ- ated with a pattern that does not resolve itself in an expected upward direction. The most typical evidence of a failed rally is diminishing volume.",Finance - The Options Course - High Profit And Low Stress Trading Methods
133,fair market value The value of an asset under normal conditions.,fair market value,,,The value of an asset under normal conditions.,Finance - The Options Course - High Profit And Low Stress Trading Methods
134,"fair value The theoretical value of what an option should be worth, usually gen- erated by an option pricing model such as the Black-Scholes.",fair value,,,"The theoretical value of what an option should be worth, usually gen- erated by an option pricing model such as the Black-Scholes.",Finance - The Options Course - High Profit And Low Stress Trading Methods
135,fast market A stock with so much volume that the order entry systems have dif- ficulty processing all of the orders.,fast market,,,A stock with so much volume that the order entry systems have dif- ficulty processing all of the orders.,Finance - The Options Course - High Profit And Low Stress Trading Methods
136,Federal Reserve System The independent central bank that influences the sup- ply of money and credit in the United States through its control of bank reserves.,Federal Reserve System,,,The independent central bank that influences the sup- ply of money and credit in the United States through its control of bank reserves.,Finance - The Options Course - High Profit And Low Stress Trading Methods
137,"Fibonacci series A mathematical series used in the markets that is produced by adding two sequential numbers to arrive at the next number in the series. Starting with 1, the series is: 1, 1, 2, 3, 5, 8, 13, 21, 34, 55, 89, 144, 233, . . . This series repre- sents common naturally occurring phenomena such as the reproduction rate of a pair of rabbits and decay relationships, among others.",Fibonacci series,,,"A mathematical series used in the markets that is produced by adding two sequential numbers to arrive at the next number in the series. Starting with 1, the series is: 1, 1, 2, 3, 5, 8, 13, 21, 34, 55, 89, 144, 233, . . . This series repre- sents common naturally occurring phenomena such as the reproduction rate of a pair of rabbits and decay relationships, among others.",Finance - The Options Course - High Profit And Low Stress Trading Methods
138,fill An executed order.,fill,,,An executed order.,Finance - The Options Course - High Profit And Low Stress Trading Methods
139,fill order An order that must be filled or canceled immediately.,fill order,,,An order that must be filled or canceled immediately.,Finance - The Options Course - High Profit And Low Stress Trading Methods
140,fill or kill An order to buy or sell an exact number of units or none at all.,fill or kill,,,An order to buy or sell an exact number of units or none at all.,Finance - The Options Course - High Profit And Low Stress Trading Methods
141,financial instruments The term used for debt instruments.,financial instruments,,,The term used for debt instruments.,Finance - The Options Course - High Profit And Low Stress Trading Methods
142,fixed delta A delta figure that does not change with the change in the underlying asset. A futures contract has a fixed delta of plus or minus 100.,fixed delta,,,A delta figure that does not change with the change in the underlying asset. A futures contract has a fixed delta of plus or minus 100.,Finance - The Options Course - High Profit And Low Stress Trading Methods
143,"flags Relatively short-lived, sideways patterns that form after a sharp rise or de- cline in price. They represent a pause in the current move that occurs at the ap- proximate midpoint. As a result, these formations have measuring implications. By definition, flags are continuation patterns. The flag resembles a rectangle that is slightly trending up or down (similar to a parallelogram). The slope's direction is often the opposite of the move prior to formation. These formations typically take one to three weeks to form, with volume diminishing into the pattern.",flags,,,"Relatively short-lived, sideways patterns that form after a sharp rise or de- cline in price. They represent a pause in the current move that occurs at the ap- proximate midpoint. As a result, these formations have measuring implications. By definition, flags are continuation patterns. The flag resembles a rectangle that is slightly trending up or down. The slope's direction is often the opposite of the move prior to formation. These formations typically take one to three weeks to form, with volume diminishing into the pattern.",Finance - The Options Course - High Profit And Low Stress Trading Methods
144,float The number of shares available for public trading in the markets.,float,,,The number of shares available for public trading in the markets.,Finance - The Options Course - High Profit And Low Stress Trading Methods
145,floor broker An exchange member who is paid a fee for executing orders.,floor broker,,,An exchange member who is paid a fee for executing orders.,Finance - The Options Course - High Profit And Low Stress Trading Methods
146,floor ticket A summary of the information on an order ticket.,floor ticket,,,A summary of the information on an order ticket.,Finance - The Options Course - High Profit And Low Stress Trading Methods
147,floor trader An exchange member who executes orders from the floor of the ex- change only for his or her own account.,floor trader,,,An exchange member who executes orders from the floor of the ex- change only for his or her own account.,Finance - The Options Course - High Profit And Low Stress Trading Methods
148,front month The first expiration month in a series of months.,front month,,,The first expiration month in a series of months.,Finance - The Options Course - High Profit And Low Stress Trading Methods
149,"fundamental analysis An approach to trading research that aims to predict futures and stock price movements based on balance sheets, income statements, past records of earnings, sales, assets, management, products, and services.",fundamental analysis,,,"An approach to trading research that aims to predict futures and stock price movements based on balance sheets, income statements, past records of earnings, sales, assets, management, products, and services.",Finance - The Options Course - High Profit And Low Stress Trading Methods
150,futures contract Agreement to buy or sell a set number of shares of a commod- ity or financial instruments in a designated future month at a price agreed on by the buyer and seller.,futures contract,,,Agreement to buy or sell a set number of shares of a commod- ity or financial instruments in a designated future month at a price agreed on by the buyer and seller.,Finance - The Options Course - High Profit And Low Stress Trading Methods
151,gamma The degree by which the delta changes with respect to changes in the underlying instrument's price.,gamma,,,The degree by which the delta changes with respect to changes in the underlying instrument's price.,Finance - The Options Course - High Profit And Low Stress Trading Methods
152,gap When the daily range is completely above or below the previous day's daily range.,gap,,,When the daily range is completely above or below the previous day's daily range.,Finance - The Options Course - High Profit And Low Stress Trading Methods
153,going ahead Unethical brokerage activity whereby the broker trades first for his or her own account before filling the customer's order(s).,going ahead,,,Unethical brokerage activity whereby the broker trades first for his or her own account before filling the customer's order(s).,Finance - The Options Course - High Profit And Low Stress Trading Methods
154,"go long To buy securities, options, or futures.",go long,,,"To buy securities, options, or futures.",Finance - The Options Course - High Profit And Low Stress Trading Methods
155,good till canceled order (GTC) An order to buy or sell stock that is good until the trader cancels it.,good till canceled order,GTC,,An order to buy or sell stock that is good until the trader cancels it.,Finance - The Options Course - High Profit And Low Stress Trading Methods
156,"go short To sell securities, options, or futures.",go short,,,"To sell securities, options, or futures.",Finance - The Options Course - High Profit And Low Stress Trading Methods
157,"gross domestic product (GDP) The total value of goods and services produced in a country during one year. It includes consumption, government purchases, in- vestments, and exports minus imports.",gross domestic product,GDP,,"The total value of goods and services produced in a country during one year. It includes consumption, government purchases, in- vestments, and exports minus imports.",Finance - The Options Course - High Profit And Low Stress Trading Methods
158,guts A strangle where the call and the put are in-the-money.,guts,,,A strangle where the call and the put are in-the-money.,Finance - The Options Course - High Profit And Low Stress Trading Methods
159,hammering the market The intense selling of stocks by speculators who think the market is about to drop because they believe prices are inflated.,hammering the market,,,The intense selling of stocks by speculators who think the market is about to drop because they believe prices are inflated.,Finance - The Options Course - High Profit And Low Stress Trading Methods
160,"head and shoulders (H&S) The head and shoulders pattern is probably one of the best-known, most reliable patterns. The pattern resembles the silhouette of a head with shrugged shoulders. Each outside peak, or shoulder, is about the same height, with the middle peak, or head, higher than both shoulders. All three peaks use the same support line (the neckline) and a specific volume pattern is seen when this reversal is valid. The pattern is not complete until there is a close below the neckline accompanied by increased volume. These reversals occur at market tops and are bearish. Price projections are possible with valid H&S patterns.",head and shoulders,H&S,,The pattern is not complete until there is a close below the neckline accompanied by increased volume. These reversals occur at market tops and are bearish. Price projections are possible with valid H&S patterns.,Finance - The Options Course - High Profit And Low Stress Trading Methods
161,hedge Reducing the risk of loss on an outright directional move by taking a posi- tion through options or futures opposite to the current position held in the market.,hedge,,,Reducing the risk of loss on an outright directional move by taking a posi- tion through options or futures opposite to the current position held in the market.,Finance - The Options Course - High Profit And Low Stress Trading Methods
162,high The highest price that was paid for a stock during a certain period.,high,,,The highest price that was paid for a stock during a certain period.,Finance - The Options Course - High Profit And Low Stress Trading Methods
163,high and low Refers to the high and low transaction prices that occur each trad- ing day.,high and low,,,Refers to the high and low transaction prices that occur each trad- ing day.,Finance - The Options Course - High Profit And Low Stress Trading Methods
164,highflier A speculative high-priced stock that moves up and down sharply over a short period of time.,highflier,,,A speculative high-priced stock that moves up and down sharply over a short period of time.,Finance - The Options Course - High Profit And Low Stress Trading Methods
165,"high-tech stock Stock of companies involved in high-technology industries, such as computers, biotechnology, robotics, electronics, and semiconductors.",high tech stock,,,"Stock of companies involved in high-technology industries, such as computers, biotechnology, robotics, electronics, and semiconductors.",Finance - The Options Course - High Profit And Low Stress Trading Methods
166,historical volatility A measurement of how much a contract's price has fluctu- ated over a period of time in the past; usually calculated by taking a standard devi- ation of price changes over a time period.,historical volatility,,,A measurement of how much a contract's price has fluctu- ated over a period of time in the past; usually calculated by taking a standard devi- ation of price changes over a time period.,Finance - The Options Course - High Profit And Low Stress Trading Methods
167,holder One who purchases an option.,holder,,,One who purchases an option.,Finance - The Options Course - High Profit And Low Stress Trading Methods
168,"HOLDRS Stands for Holding Company Depositary Receipts, which are ex- change-traded funds that hold baskets of stocks from specific industry groups. HOLDRS trade on the American Stock Exchange and can be bought or sold in lots of 100 shares. For example, investors can buy or sell Biotechnology HOLDRS",HOLDRS,,,"Stands for Holding Company Depositary Receipts, which are ex- change-traded funds that hold baskets of stocks from specific industry groups. HOLDRS trade on the American Stock Exchange and can be bought or sold in lots of 100 shares. For example, investors can buy or sell Biotechnology HOLDRS",Finance - The Options Course - High Profit And Low Stress Trading Methods
169,"(BBH), Semiconductor HOLDRS (SMH), or Oil Service HOLDRS (OIH). In all, the American Stock Exchange offers trading in 17 different HOLDRS. Options are also available on these exchange-trade funds and can be used to profit from trends re- lated to specific sectors or industry groups.","(BBH), Semiconductor HOLDRS",BBH,,"In all, the American Stock Exchange offers trading in 17 different HOLDRS. Options are also available on these exchange-trade funds and can be used to profit from trends re- lated to specific sectors or industry groups.",Finance - The Options Course - High Profit And Low Stress Trading Methods
170,illiquid market A market that has no volume; slippage is subsequently created due to lack of trading volume.,illiquid market,,,A market that has no volume; slippage is subsequently created due to lack of trading volume.,Finance - The Options Course - High Profit And Low Stress Trading Methods
171,immediate/cancel order An order that must be filled immediately or canceled.,immediate cancel order,,,An order that must be filled immediately or canceled.,Finance - The Options Course - High Profit And Low Stress Trading Methods
172,income statement A financial statement that shows a company's revenues and expenditures over a stated period (usually one quarter or year) resulting in either a profit or a loss.,income statement,,,A financial statement that shows a company's revenues and expenditures over a stated period resulting in either a profit or a loss.,Finance - The Options Course - High Profit And Low Stress Trading Methods
173,"index A group of stocks that can be traded as one portfolio, such as the S&P 500. Broad-based indexes cover a wide range of industries and companies, and narrow- based indexes cover stocks in one industry or economic sector.",index,,,"A group of stocks that can be traded as one portfolio, such as the S&P 500. Broad-based indexes cover a wide range of industries and companies, and narrow- based indexes cover stocks in one industry or economic sector.",Finance - The Options Course - High Profit And Low Stress Trading Methods
174,index options Call options and put options on indexes of stocks are designed to reflect and fluctuate with market conditions. Index options allow investors to trade in a specific industry group or market without having to buy all the stocks in- dividually.,index options,,,Call options and put options on indexes of stocks are designed to reflect and fluctuate with market conditions. Index options allow investors to trade in a specific industry group or market without having to buy all the stocks in- dividually.,Finance - The Options Course - High Profit And Low Stress Trading Methods
175,inflation Increases in the general price level of goods and services; it is com- monly reported using the consumer price index as a measure. Inflation is one of the major risks to investors over the long term as savings may actually buy less in the future if they do not return an amount in excess of price increases.,inflation,,,Increases in the general price level of goods and services; it is com- monly reported using the consumer price index as a measure. Inflation is one of the major risks to investors over the long term as savings may actually buy less in the future if they do not return an amount in excess of price increases.,Finance - The Options Course - High Profit And Low Stress Trading Methods
176,"inside information Material information that has not been disseminated to, or is not readily available to, the general public.",inside information,,,"Material information that has not been disseminated to, or is not readily available to, the general public.",Finance - The Options Course - High Profit And Low Stress Trading Methods
177,institutional investor A person or organization that trades securities in large enough share quantities or dollar amounts that it qualifies for preferential treat- ment and lower commissions. These entities are assumed to be more knowledge- able investors who are better able to protect themselves from risk.,institutional investor,,,A person or organization that trades securities in large enough share quantities or dollar amounts that it qualifies for preferential treat- ment and lower commissions. These entities are assumed to be more knowledge- able investors who are better able to protect themselves from risk.,Finance - The Options Course - High Profit And Low Stress Trading Methods
178,"interest rate The charge for the privilege of borrowing money, usually ex- pressed as an annual percentage rate.",interest rate,,,"The charge for the privilege of borrowing money, usually ex- pressed as an annual percentage rate.",Finance - The Options Course - High Profit And Low Stress Trading Methods
179,interest rate–driven Refers to a point in the business cycle when interest rates are declining and bond prices are rising.,interest rate–driven,,,Refers to a point in the business cycle when interest rates are declining and bond prices are rising.,Finance - The Options Course - High Profit And Low Stress Trading Methods
180,intermarket analysis Observing the price movement of one market for the pur- pose of evaluating a different market.,intermarket analysis,,,Observing the price movement of one market for the pur- pose of evaluating a different market.,Finance - The Options Course - High Profit And Low Stress Trading Methods
181,intermarket spread A spread consisting of opposing positions in instruments with two different markets.,intermarket spread,,,A spread consisting of opposing positions in instruments with two different markets.,Finance - The Options Course - High Profit And Low Stress Trading Methods
182,in-the-money (ITM) When exercising an option would generate a profit at the time. A call option is in-the-money if the strike price is less than the market price of the underlying security. A put option is in-the-money if the strike price is greater than the market price of the underlying security.,in the money,ITM,,When exercising an option would generate a profit at the time. A call option is in-the-money if the strike price is less than the market price of the underlying security. A put option is in-the-money if the strike price is greater than the market price of the underlying security.,Finance - The Options Course - High Profit And Low Stress Trading Methods
183,intrinsic value The amount by which an option is in-the-money. Out-of-the- money options have no intrinsic value. Calls = underlying asset less strike price. Puts = strike price less underlying asset.,intrinsic value,,,The amount by which an option is in-the-money. Out-of-the- money options have no intrinsic value. Calls = underlying asset less strike price. Puts = strike price less underlying asset.,Finance - The Options Course - High Profit And Low Stress Trading Methods
184,"inverse relationship Two or more markets that act totally opposite to one an- other, producing negative correlations.",inverse relationship,,,"Two or more markets that act totally opposite to one an- other, producing negative correlations.",Finance - The Options Course - High Profit And Low Stress Trading Methods
185,investment Any purchase of an asset to increase future income.,investment,,,Any purchase of an asset to increase future income.,Finance - The Options Course - High Profit And Low Stress Trading Methods
186,iron butterfly The combination of a long (or short) straddle and a short (or long) strangle. All options must have the same underlying asset and the same expiration.,iron butterfly,,,The combination of a long strangle. All options must have the same underlying asset and the same expiration.,Finance - The Options Course - High Profit And Low Stress Trading Methods
187,"lagging indicator A technical indicator can lead or follow price action. A lagging indicator will move in a bullish or bearish direction after the same bullish or bear- ish price move. The extent to which an indicator lags is dependent upon the “speed” of the indicator. Lagging indicators include moving averages, envelopes, and channels. Many economic indicators are also considered lagging indicators that follow the overall pace of the economy.",lagging indicator,,,"A technical indicator can lead or follow price action. A lagging indicator will move in a bullish or bearish direction after the same bullish or bear- ish price move. The extent to which an indicator lags is dependent upon the “speed” of the indicator. Lagging indicators include moving averages, envelopes, and channels. Many economic indicators are also considered lagging indicators that follow the overall pace of the economy.",Finance - The Options Course - High Profit And Low Stress Trading Methods
188,"leading indicator Technical indicators can precede or lag price action. A leading indicator will move in a bullish or bearish direction prior to the same bullish or bearish price move. It is important to note that leading indicators can provide false signals; therefore, price confirmation is important. Leading indicators in- clude volume and momentum, among other oscillators.",leading indicator,,,"Technical indicators can precede or lag price action. A leading indicator will move in a bullish or bearish direction prior to the same bullish or bearish price move. It is important to note that leading indicators can provide false signals; therefore, price confirmation is important. Leading indicators in- clude volume and momentum, among other oscillators.",Finance - The Options Course - High Profit And Low Stress Trading Methods
189,leg One side of a spread.,leg,,,One side of a spread.,Finance - The Options Course - High Profit And Low Stress Trading Methods
190,Level II quotes One of three levels of the National Association of Securities Dealers Automated Quotations System (Nasdaq). Level I quotes provide basic in- formation such as the best bids and asks for Nasdaq-listed stocks. Level II data provides investors with more detailed quotes and information. Level II users have access to current bids and offers for all market makers in a given Nasdaq-listed stock. Level III is the most advanced level and is used by market makers to enter their own quotes to the system.,Level II quotes,,,One of three levels of the National Association of Securities Dealers Automated Quotations System. Level I quotes provide basic in- formation such as the best bids and asks for Nasdaq-listed stocks. Level II data provides investors with more detailed quotes and information. Level II users have access to current bids and offers for all market makers in a given Nasdaq-listed stock. Level III is the most advanced level and is used by market makers to enter their own quotes to the system.,Finance - The Options Course - High Profit And Low Stress Trading Methods
191,limit move The maximum daily price limit for an exchange-traded contract.,limit move,,,The maximum daily price limit for an exchange-traded contract.,Finance - The Options Course - High Profit And Low Stress Trading Methods
192,limit order An order to buy a stock at or below a specified price or to sell a stock at or above a specified price.,limit order,,,An order to buy a stock at or below a specified price or to sell a stock at or above a specified price.,Finance - The Options Course - High Profit And Low Stress Trading Methods
193,"limit up, limit down Commodity exchange restrictions on the maximum up- ward or downward movements permitted in the price for a commodity during any trading session day.","limit up, limit down",,,Commodity exchange restrictions on the maximum up- ward or downward movements permitted in the price for a commodity during any trading session day.,Finance - The Options Course - High Profit And Low Stress Trading Methods
